description,courseNumber,departmentCode,courseTitle,avg_gpa,A_rate,B_rate,C_rate,D_rate,F_rate,W_rate,total_enrollment
"Introduction to beginning jazz dance technique. Focuses on placement, isolations and rhythmicality.",168,DANC,"Jazz Dance",3.69,77.00,14.00,5.00,1.00,2.00,4.00,332
"A general introduction to economic ideas and analysis with emphasis on economic institutions and processes in the context of a market economy. Includes basic discussion of microeconomic and macroeconomic topics including economic decision making in the context of scarce resources, price theory, monetary and fiscal policy, etc. This course is intended for nonbusiness majors.",150,ECON,"Principles of Economics",2.63,22.00,37.00,23.00,8.00,7.00,6.00,1123
"Explores literature of America's ethnic cultures and their historical and literary contexts. May include literature written by Americans of African, Asian, Arab, Latina/o and/or Native American ancestry.",257,ENGL,"Ethnic Literature of the United States",3.28,47.00,39.00,11.00,3.00,1.00,2.00,254
"Examines human metabolism in relation to health and human performance. Analysis of nutrient pathways from ingestion, digestion, absorption and utilization provides the foundation for an understanding of nutrition, weight control, eating disorders and thermoregulatory processes.",317,EXSC,"Nutrition, Health and Human Performance",3.27,44.00,42.00,13.00,2.00,1.00,1.00,605
"Introduction to basic information and skills required to administer care in emergency situations. Students may earn a nationally recognized certification in emergency cardiovascular care (CPR/AED) and first aid. M",102,FTWL,"First Aid and Emergency Care",0.00,0.00,0.00,0.00,0.00,19.00,82.00,32
"Examine the interaction of physical education and sport with the psychology and sociological development of the individual. Better understand society's impact on sport and human movement and develop perspective on the impact psychology has on sports, physical education and human movement.",351,PHED,"Psychosocial Aspects of Physical Education",3.56,64.00,31.00,4.00,0.00,2.00,1.00,410
"Introduction to the causes of interstate conflict in the Middle East and to the opportunities for peace in the region. Examines the impact of Great Power competition, the regional balance of power, the rise of religious fundamentalism and the struggle for control of resources. Includes an analysis of the Arab-Israeli conflict, as well as other examples of conflict and accommodation in the region.",213,POSC,"War and Peace in the Middle East",3.15,50.00,24.00,17.00,3.00,5.00,4.00,114
"Survey of general principles underlying human behavior including study of the nervous system, perception, learning, emotion and personality. Experimental findings are applied to practical situations.",101,PSYC,"General Psychology",3.07,42.00,34.00,16.00,4.00,4.00,2.00,4649
"Provides opportunities for investigating special themes or issues of interest to students and the social work profession.",499,SOWK,"Special Topics",3.39,53.00,36.00,7.00,0.00,3.00,3.00,74
"Development of skills and attitudes for working with chemicals in a confident and responsible way. Emphasis on safety precautions and emergency procedures in case of a chemical accident.",207,CHEM,"Laboratory Safety",3.09,34.00,44.00,11.00,2.00,4.00,7.00,192
"Survey of British literature from the Restoration in 1660 to the present day. Readings may include, but are not limited to, Swift, Pope, Austen, Wordsworth, Keats, the Brownings, Hardy, Yeats, Woolf and Greene. Poetry and fiction included.",357,ENGL,"British Literature II: 1660-Present",3.12,41.00,37.00,11.00,2.00,6.00,6.00,190
"Interdisciplinary seminar with content varying semester to semester.",290,THEA,"Special Topics in Theatre",2.90,40.00,34.00,6.00,4.00,12.00,4.00,50
"Fundamental course in the study of microorganisms and their activity, with emphasis on bacteria.",211,BIOL,Microbiology,2.42,16.00,32.00,29.00,11.00,7.00,9.00,2277
"Blended lecture/lab experience in experimental chemistry. Emphasis on the relationship between synthesis, instrumental methods and thermodynamic principles.",441,CHEM,"Advanced Experimental Chemistry I",3.52,64.00,30.00,6.00,1.00,2.00,0.00,130
"Fundamentals of public relations, including history of the field, theories of persuasion and communication, legal and ethical considerations, and the current state and future of the practice.",248,CMAT,"Introduction to Public Relations",3.13,38.00,37.00,21.00,1.00,2.00,5.00,185
"Introduction to common communication research methods, including: literature reviews, surveys, experiments, content analysis, rhetorical criticism, ethnography, interviews and focus groups. Students learn essential research and writing skills through projects created in areas of interest such as relationships, business, media, or advertising/public relations.",297,CMAT,"Communication Research",2.96,27.00,48.00,19.00,3.00,3.00,2.00,460
"A survey of representative works of science fiction on a persistent theme or theme, such as artificial intelligence, time travel or alien cultures by major authors of the genre.",345,ENGL,"Science Fiction",2.81,26.00,25.00,17.00,6.00,4.00,24.00,134
"Historical study of particular periods; groups; economic, intellectual and/or social movements; and institutions.",215,HIST,"Topics in History",3.02,43.00,25.00,15.00,5.00,6.00,8.00,860
"A basic introduction to interdisciplinary studies aimed at students considering the Interdisciplinary Studies Individually Designed Track. Introduces students to the fundamental tenets and values of an interdisciplinary course of study.",235,IDIS,"Introduction to Interdisciplinary Studies",3.64,85.00,4.00,3.00,1.00,7.00,3.00,273
"Introduces students to the fundamental concepts of the physical sciences. The course will emphasize practical applications, especially those which integrate all of the natural sciences. The course assumes an understanding of college algebra and is for elementary education majors who have not successfully completed CHEM 101.",101,PHYS,"Physical Science",2.64,25.00,31.00,26.00,11.00,5.00,6.00,1246
"Introductory course for non-science majors. Principles of astronomy are developed in a conceptual way. Topics covered include scale of the universe, a guide to the sky, cycles of the sun and moon, atoms and spectra, the sun and stars, structure and evolution of stars, the Milky Way and other galaxies, the solar system, and life on other worlds.",109,PHYS,"Principles of Astronomy",2.79,28.00,34.00,18.00,8.00,5.00,11.00,477
"Focuses on student-developed research projects that utilize the scientific method and the collection and analysis of quantitative data, especially public opinion polls. The use of computers and statistics in political science research emphasized.",300,POSC,"Methods of Empirical Political Analysis",2.94,38.00,32.00,18.00,2.00,8.00,5.00,337
"Practical experience in technical theatre including set construction, scene painting, lighting and sound.",110,THEA,"Technical Production",3.28,60.00,23.00,9.00,4.00,6.00,1.00,217
"Seminar and practicum focused on local environmental issue. Students will analyze the issue by doing background research and interviewing stakeholders. The seminar will culminate with a formal presentation in which students present their analysis and suggestions. Suggestions will be implemented if time and topic permits.",499,ENVR,"Environmental Senior Seminar",3.61,69.00,23.00,7.00,0.00,1.00,1.00,300
"Overview of medical terminology by body system. Principles of decoding words by word elements (prefix, suffix, word root) and standard combining rules.",201,HLSC,"Medical Terminology",3.67,74.00,16.00,6.00,1.00,2.00,5.00,299
"Introduces history and theory of experiential and outdoor education, including a survey of relevant literature and best practices. Includes leadership techniques, the role of risk, humankind's relationship with nature and ethics. Develop a personal philosophy of outdoor education. Required to participate in an off-campus field experience. Course fee applies.",200,ODEL,"Foundations of Outdoor Education Leadership",3.43,59.00,24.00,8.00,3.00,3.00,6.00,285
"Focuses on the structure and function of eukaryotic cells. Topics covered include enzyme kinetics, membrane transport, cell signaling, intercellular protein trafficking, cellular respiration, mitosis and meiosis, the cell cycle, and cancer.",350,BIOL,"Cell Biology",2.79,28.00,37.00,20.00,7.00,6.00,5.00,1050
"Surveys the basic competencies necessary to articulate oneself effectively in a variety of communication settings. Topics include interpersonal and intercultural relationships, formal and informal groups, and public forums with a primary focus on basic presentation skills.",100,COMM,"Fundamentals of Communication",3.20,52.00,28.00,10.00,3.00,7.00,3.00,1207
"Introduction to the basic principles and theories of human communication. Explores contexts such as interpersonal relationships, small groups, organizations, intercultural interaction and public speaking. In each context, practice skills of effective communication while gaining understanding of the relevant theories and research that are foundational to the discipline. Designed for communication arts majors and minors.",101,COMM,"Introduction to Human Communication Studies",3.27,54.00,28.00,10.00,2.00,6.00,4.00,656
"Fundamentals of public relations, including history of the field, theories of persuasion and communication, legal and ethical considerations, and the current state and future of the practice.",248,COMM,"Introduction to Public Relations",3.15,39.00,43.00,10.00,3.00,3.00,4.00,142
"Study of human communication systems in organizations. Students explore one-to-one, small group and one-to-many communication, and develop the skills needed in organizational communication.",260,COMM,"Business and Professional Communication",3.27,54.00,27.00,11.00,3.00,5.00,4.00,794
"Introduction to common communication research methods, including: literature reviews, surveys, experiments, content analysis, rhetorical criticism, ethnography, interviews and focus groups. Students learn essential research and writing skills through projects created in areas of interest such as relationships, business, media, or advertising/public relations.",297,COMM,"Communication Research",3.14,37.00,46.00,13.00,4.00,2.00,2.00,186
"Continuation of the study of the design, implementation and testing of programs. Further study of object-oriented programming. Introduction of graph algorithms. Emphasis is on analysis of algorithms and abstraction.",320,COSC,"Advanced Data Structures and Algorithm Analysis",2.57,23.00,28.00,27.00,8.00,8.00,8.00,680
"Introduces different modes of disciplinary inquiry compatible with social studies instruction. Teacher candidates develop skills in understanding, planning, delivering and assessing instruction with a focus on sociocultural development and classroom management. Course objectives and activities are based on the College, Career and Civic Life four-stage model of inquiry from the National Council for the Social Studies and align with Maryland state standards for early childhood social studies. Includes clinical experiences.",453,ECED,"Teaching Social Studies in Early Childhood Classrooms",3.82,83.00,17.00,2.00,0.00,0.00,1.00,191
"Vectors, Euclidean space geometry including curves and arc length, functions of several variables, partial differentiation, multiple integrals including surface area, vector calculus, and/or other related topics.",310,MATH,"Calculus III",2.81,31.00,34.00,19.00,6.00,7.00,7.00,662
"Modern abstract analysis including topology of the real number system, sequences, continuity, differentiability and integration.",451,MATH,"Analysis I",2.59,25.00,26.00,20.00,13.00,6.00,13.00,236
"Develops abilities to reason effectively analyze problems, identify issues, critically evaluate evidence, argue logically, and reach and defend justifiable conclusions.",103,PHIL,"Critical Thinking",2.05,14.00,25.00,29.00,14.00,16.00,4.00,503
"Introduction to calculus-based Newtonian mechanics for students majoring in physics, engineering and chemistry. Topics include: kinematics, Newton's laws, conservation laws and rotational motion.",221,PHYS,"Physics I",2.66,28.00,29.00,19.00,6.00,9.00,11.00,550
"Survey of the characteristics of and theories explaining the physical, intellectual, social and emotional development of individuals throughout the life span.",200,PSYC,"Developmental Psychology",3.38,56.00,31.00,10.00,2.00,2.00,2.00,755
"In-depth study of the implications of and issues surrounding the physical, intellectual, social and emotional development of children from conception to adolescence.",250,PSYC,"Psychology of Infancy and Childhood",3.01,36.00,40.00,16.00,3.00,5.00,3.00,709
"Explores the ability to create and maintain productive learning environments in the middle and high schools. Emphasis on development of learner responsibility, promotion of positive social relationships, interdependence of effective instruction and management, and prevention/intervention strategies. Consideration given to accommodating diversity and communicating with families. Field activity required.",434,SCED,"Classroom Management",3.69,77.00,17.00,4.00,2.00,1.00,2.00,254
"Engages in full-time clinical experience with designated mentors in Professional Development School (PDS) sites, progressively assuming the lead-teacher role in the classroom while planning and co-teaching with the mentor. Direct supervision under the direction of a mentor teacher and University supervisor. One, eight-week, full-time, supervised clinical experience in a school. Clinical Practice in lower (grades 1-3) or upper elementary (grades 4-6) grade levels.",421,ELED,"Elementary Education Clinical Practice I",0.00,0.00,0.00,0.00,0.00,67.00,34.00,3
"Engages in full-time clinical experience with designated mentors in Professional Development School (PDS) sites, progressively assuming the lead-teacher role in the classroom while planning and co-teaching with the mentor. Direct supervision under the direction of a mentor teacher and University supervisor. One, eight-week, full-time, supervised clinical experience in a school. Clinical Practice in lower (grades 1-3) or upper elementary (grades 4-6) grade levels.",422,ELED,"Elementary Education Clinical Practice II",0.00,0.00,0.00,0.00,0.00,50.00,50.00,4
"Study of literature (written in English) by Latina and Latino writers, including, but not limited to, Mexican American (Chicana/o), Puerto Rican American, Cuban American and Dominican American authors.",256,ENGL,"Latina/o Literature",3.36,60.00,23.00,14.00,3.00,2.00,0.00,67
"Study of a literary figure, period, genre, movement or theme.",300,ENGL,"Studies in English Literature",3.41,53.00,32.00,8.00,2.00,2.00,7.00,746
"Focuses on the interlinked natural and social systems of the contemporary world. Particular attention is given to the qualitative social sciences and history, and to analyzing the public and political discourses surrounding environmental regimes.",302,ENVR,"Society and Environment",3.12,41.00,34.00,16.00,4.00,3.00,6.00,297
"Introduction to management and instructional strategies specific to teaching physical education in grades K-12. Content includes rationale for skill progressions, scope and sequence of physical education curriculum, and program planning.",275,PHED,"Management and Instructional Strategies in Physical Education",3.64,71.00,24.00,2.00,1.00,2.00,2.00,955
"Focuses on the contribution of psychological theories on the legal system and the increasing use of mental health professionals in this system. Topics to be covered include a variety of issues related to ways the fields of psychology and legal studies intersect, including examining theories of crime, stages of the trial process, police training, judge and jury decision making, use of expert witnesses, the insanity defense, witness reliability and crime victims.",375,PSYC,"Psychology and the Law",3.56,63.00,31.00,7.00,1.00,0.00,1.00,299
"Engages pre-service teachers in planning, teaching, assessment and collaboration in order to support and enhance student learning and well-being. Participation in activities required of fully employed teachers.",426,SCED,"Internship in Middle or High School Education",0.00,0.00,0.00,0.00,0.00,25.00,75.00,4
"Examines communities, groups and organizations as social systems and environmental contexts. Reflects social work's values and principles in the macro social environment and the integration of theories drawn from sociology, psychology, biology, anthropology and economics to understand and critically analyze the multiple influences on human behavior as affected by race, class, gender, age and sexual orientation. Develops macro-assessment skills within the framework of empowerment.",302,SOWK,"Human Behavior in the Social Environment II",3.45,62.00,26.00,8.00,2.00,3.00,2.00,957
"Introduces the skills, abilities and knowledge related to functioning in a professional business environment. Focus on developing those skills considered important by employers as well as familiarizing students with the ABLE graduation requirement. Sessions vary in duration, depending on the activities involved, which are subject to change. Writing assignments and mandatory attendance at events.",200,BUAD,"Personal and Professional Development for Business",0.00,0.00,0.00,0.00,0.00,39.00,62.00,342
"Covers the basic skills and techniques required for audio production in media. Emphasis is on the aesthetics, principles and practices in producing and designing audio programs for media.",234,COMM,"Beginning Audio Production",3.82,87.00,10.00,0.00,0.00,3.00,3.00,96
"Introduction to the equipment and techniques of television studio production. Each student produces and directs a variety of live-to-tape productions. Outside class crew hours required.",243,COMM,"Television Studio Production",3.61,67.00,30.00,2.00,0.00,2.00,2.00,71
"Introduces students to an array of study strategies and campus resources to help them be academically successful during their collegiate career. Topics include time management, note-taking, test preparation, college writing and more. Seven-week course.",103,GENL,"Advanced Learning Strategies",3.37,63.00,20.00,4.00,2.00,8.00,6.00,208
"The study of coastlines, coastal landforms, and the tectonic and oceanographic forces that shape them. One mandatory Saturday half-day field trip to Assateague Island is required.",111,GEOG,"Introduction to Oceans and Coasts",2.48,22.00,29.00,29.00,11.00,7.00,6.00,556
"A comprehensive course for undergraduate students seeking an academic career integrating multiple disciplines. Provides an in-depth study examining the purpose and value of an interdisciplinary course of study. Consider and design individualized programs as well as initiate interdisciplinary research.",335,IDIS,"Fundamentals of Interdisciplinary Studies",3.17,49.00,32.00,8.00,1.00,8.00,4.00,450
"A general historical survey of musical styles and genres from around the world. Topics may include Western classical music, non-Western cultures, folk music and jazz.",114,MUSC,"Music Appreciation",3.24,51.00,30.00,11.00,4.00,3.00,4.00,671
"Intensive study in a psychological therapeutic technique, person, developmental period or theory.",495,PSYC,"Selected Topics in Psychology",3.58,70.00,19.00,7.00,3.00,1.00,3.00,259
"Introduces the non-biology major to the broad principles, fundamental ideas and new discoveries in biology that significantly affect the human being's present and future existence. Relates the study of biology to the pressing social and cultural issues of today. Does not satisfy requirements within the major.",105,BIOL,"Biology and Society",3.03,36.00,37.00,14.00,5.00,4.00,7.00,483
"Study of the production of television and film programs using single camera and editing techniques.",343,COMM,"Video Field Production",3.33,66.00,19.00,6.00,2.00,9.00,0.00,85
"Complements student teaching internship for elementary/early childhood/dual certification education majors. Integrates theory and practice, facilitates the process of learning to reflect upon one's teaching, and provides support for candidates making the transition from teacher candidate to professional educator. Meets at school sites on a schedule to be announced as part of SU's Professional Development School partnership. Includes clinical experiences.",411,ELED,"Clinical Practice Seminar",3.85,88.00,10.00,2.00,1.00,1.00,1.00,1550
"Designed to help students understand, evaluate and conduct exercise science research. Class members will learn basic concepts and procedures used for conducting research and will become better consumers of research. Students will collaborate to design and present their original research study proposal.",301,EXSC,"Research Methods in Exercise Science",3.52,78.00,11.00,3.00,0.00,9.00,3.00,49
"Directed student internship experience in K-12 schools under the direction of the mentor teacher and University supervision. Half the experience in elementary physical education teaching and half semester in secondary physical education. A grade of NR will be assigned to candidates who satisfactorily complete PHED 470 until successful completion of PHED 471.",471,PHED,"Internship II in Secondary Physical Education",0.00,0.00,0.00,0.00,0.00,0.00,0.00,0
"Engages pre-service teachers in planning, teaching, assessment and collaboration in order to support and enhance student learning and well-being. Participation in activities required of fully employed teachers.",428,SCED,"Internship in Middle or High School Education",0.00,0.00,0.00,0.00,0.00,0.00,100.00,1
"Theory, history, structure and functions of mass media (print, film, recording, radio, television, new media), advertising, journalism and public relations.",102,COMM,"Introduction to Mass Media",3.26,52.00,30.00,12.00,2.00,5.00,2.00,654
"Introduces and explores the principles of science education with appropriate methodology and pedagogy that focus on the needs of children birth through grade 3. Attention is given to developmentally appropriate practices and inquiry teaching methods that align to national standards. Special emphasis is given to conceptual learning, cognitive experiences, assessment, research, technology and use of instructional materials that are related to the learning of young children theoretically, developmentally and practically. Includes clinical experiences.",452,ECED,"Teaching Science in Early Childhood Classrooms",3.79,82.00,16.00,2.00,0.00,1.00,1.00,192
"Introduction to basic information and skills required to administer care in emergency situations. Students may earn a nationally recognized certification in emergency cardiovascular care (CPR/AED) and first aid.",102,HLSC,"First Aid and Emergency Care",0.00,0.00,0.00,0.00,0.00,30.00,70.00,10
"Introduces fundamental concepts and skills that form the basis of public health and health education. Historical and contemporary philosophies, principles of the profession, and competencies related to school and community settings are discussed, as well as current health issues. In addition to content knowledge, develop skills in needs assessment and objective writing for health programming.",110,HLTH,"Foundations of Public Health Education",3.58,72.00,19.00,6.00,1.00,3.00,2.00,775
"Continuation of foundational legal and ethical principles relating to business and commerce. Topics include professional liability, business entities, sales contracts, secured transactions, bankruptcy, property law, wills and estates, agency law, employment regulation, and white collar crime. Designed for those who will be providing accounting or consulting services to various types of companies by stressing critical thinking and problem-solving, and includes legal topics commonly found on the uniform CPA examination.",348,ACCT,"Business Law",3.05,31.00,43.00,21.00,1.00,2.00,5.00,471
"In-depth study of the concepts, principles and procedures of accounting for business combinations, branches, partnerships, segment and SEC reporting, estates and trusts, and bankruptcies.",403,ACCT,"Advanced Accounting I",3.11,35.00,43.00,21.00,1.00,1.00,1.00,417
"An introduction to fundamentals of fraud examination, including nature and types of fraud, fraud prevention, and techniques to detect fraud in organizations. Provides the foundation to understanding fraud and its impact on the world around us.",418,ACCT,"Fraud Examination",3.21,38.00,44.00,16.00,0.00,1.00,3.00,567
"Introduction to a variety of international accounting issues encountered by multinational organizations. Areas of focus include International Financial Reporting Standards, consolidations, transfer pricing, taxation, international auditing, strategic planning and corporate social reporting.",430,ACCT,"International Accounting",2.79,19.00,46.00,32.00,3.00,1.00,2.00,421
"Introduction to the study of human biological and cultural evolution from the earliest hominins to the present, with an emphasis on paleoanthropological and archaeological research.",102,ANTH,"Biological Anthropology and Archaeology",2.23,16.00,30.00,25.00,12.00,14.00,6.00,324
"Introduction to monochromatic and polychromatic drawing techniques using wet and dry media. Students furnish their own materials. B.F.A. core.",230,ART,"Drawing II",3.50,62.00,30.00,2.00,1.00,4.00,4.00,216
"Introduction to techniques in oil, acrylics and watercolor. Students furnish their own materials. B.A. and B.F.A. core.",246,ART,"Painting I",3.58,69.00,22.00,7.00,1.00,2.00,2.00,351
"An integrated and cohesive approach to new media used in contemporary production environments. Includes a field trip to a contemporary art exhibition which focuses on time-based new media art.",280,ART,"New Media I",3.51,72.00,11.00,6.00,2.00,5.00,7.00,222
