description,courseNumber,departmentCode,courseTitle,avg_gpa,A_rate,B_rate,C_rate,D_rate,F_rate,W_rate,total_enrollment
"Study of techniques for navigating in wilderness settings, including topographical map reading, orienteering and the use of global positioning systems. Study of alternative methods of navigation, and testing and application of skills in classroom and outdoor settings. Weekend off-campus field experience required. Course fees apply;",221,PHEC,"Wilderness Naviagation",3.91,90.00,6.00,2.00,0.00,0.00,4.00,57
"Introduction to the principles and practices of coaching. Emphasis on educational and motivational variables present in the medium of athletics. Three practice analysis fieldwork assignments required in 45 clinical hours.",330,PHEC,"Athletic Coaching",3.62,75.00,16.00,5.00,1.00,3.00,2.00,368
"Prepares individuals to coach children in athletic activities. Emphasis is placed on communicating the essentials of a sport to children at an early stage of development (6-10 years old). Discussion focuses on the coach as a teacher and the influence of the coach's behavior on the outcome of sporting events and the development of the child. Assignments (including 45 hours of clinical field experience). and activities are designed to demonstrate ways to help children develop healthy bodies and positive self-images through participation in athletics; identify techniques that promote positive discipline both on and off the playing field; and plan strategies to involve parents in positive ways.",331,PHEC,"Coaching Youth Sports",3.53,66.00,23.00,8.00,1.00,2.00,3.00,340
"3 hours credit Introduces students to experiential, adventure-based education. Study and practice principles and theories of leadership education within a cooperative learning approach.",472,PHEC,"Experiential Learning and Methods of Teaching Outdoor Activities",3.49,73.00,14.00,9.00,0.00,6.00,0.00,37
"Introduction to the historical and philosophical foundations of physical education, fitness and sport. Includes instructional and self-assessment strategies in preparation for engagement in professional practice.",135,PHED,"Foundations of Physical Education",3.21,47.00,32.00,13.00,2.00,4.00,4.00,347
"Provides information, strategies and resources to assist future physical educators or related professionals to lead health-related fitness activity. Engage in the application of health-related activities through planning and implementing such activities in small and large peer group applications, including individual and group exercise, strength training and aquatics.",175,PHED,"Introduction to Teaching Fitness and Wellness",3.60,68.00,28.00,4.00,1.00,1.00,1.00,1302
"Introduction designed to assist pre-service physical educators in identifying the connections between curricular concepts and movement education on the basis of national standards specific to grades K-5. Content includes the lesson planning and teaching of movement concepts, integrated lessons, and movement education enhanced by technology and applied in authentic settings.",245,PHED,"Movement Education in Physical Education",3.51,63.00,29.00,6.00,2.00,1.00,2.00,266
"Overview of a variety of teaching methods for how to teach individual and dual activities and sports, at game stages 1, 2, 3 and 4 using different curriculum models. Emphasis is on the knowledge and competencies that prepare students to become effective teachers of physical activities.",260,PHED,"Team and Individual Sports and Activities",3.65,73.00,15.00,8.00,1.00,1.00,5.00,738
"A continuation of the application of fundamental skills and teaching progressions for game concepts and tactics in the field and court category. Emphasis on sequential development of tactical complexity including offensive and defensive strategies.",263,PHED,"Teaching Team Sports Concepts and Tactics II",3.56,66.00,23.00,5.00,2.00,2.00,5.00,421
"Study of motor skill performance and learning. Topics include information processing, motor programs, individual differences, transfer, practice organization and feedback. Credit may not be received for both PHED 352 and 255.",352,PHED,"Motor Learning",3.00,25.00,51.00,18.00,3.00,1.00,4.00,404
"An introduction to seminal texts, central questions and rival traditions in the philosophy of education. Works from main authors in Wester philosophy are read to address questions about education and schooling as dimensions of human life. Develop an appreciation of the role of philosophy for personal and communal growth, and to form one's own philosophy of education. This course has a civic engagement component.",207,PHIL,"Philosophy of Education",3.46,62.00,23.00,5.00,3.00,3.00,7.00,149
"Promotes understanding of religious experience by focusing on a variety of its aspects, such as worship, prayer, vocation, mysticism, secularity and the encounter with evil.",325,PHIL,"Philosophy of Religion",2.89,37.00,35.00,5.00,3.00,13.00,10.00,41
"Examines the foundations and nature of morality. A study of metaethical and normative ethical questions, such as: Are claims about morals objective? If so, what makes them so? Are there general principles or rules that we should follow? Or is morality best understood in terms of virtues?",401,PHIL,"Moral Theory",3.33,40.00,48.00,8.00,0.00,0.00,4.00,25
"Survey of modern astronomy for non-science majors. Basic physics concepts are utilized to study the night sky, light, optics and telescopes, planets, the moon and sun, stars nebulae, galaxies and the universe. Some night observations required.",108,PHYS,"Introduction to Astronomy",2.99,39.00,32.00,18.00,7.00,4.00,4.00,644
"Continuation of general physics. Topics include basic concepts of electricity and magnetism, wave motion, optics and modern physics.",123,PHYS,"General Physics II",3.15,39.00,40.00,13.00,3.00,3.00,5.00,777
"Survey of basic principles of electric circuits and modern electronics. Topics include AC and DC circuits, Thevenin's and Norton's theorems, transient analysis, power supplies, diodes and transistors, operational amplifiers and an introduction to circuit simulation programs.",311,PHYS,"Electrical Circuits and Electronics",3.23,45.00,38.00,13.00,5.00,0.00,0.00,196
"Survey of physics concepts developed since 1880. Topics include blackbody radiation, photoelectric effect, special relativity, quantization, uncertainty principle and introductory atomic, nuclear and solid state physics.",313,PHYS,"Introduction to Modern Physics",2.84,33.00,36.00,18.00,10.00,4.00,1.00,128
"Introduction to the principles of quantum mechanics. Topics include wave mechanics, Schrodinger's equation, Fourier techniques, operator formalism, correspondence and uncertainty principles, harmonic oscillator and the hydrogen atom.",316,PHYS,"Introduction to Quantum Mechanics",3.36,55.00,37.00,0.00,10.00,0.00,0.00,11
"Study of the basic concepts of digital electronics, with emphasis on modern TTL and CMOS integrated circuits. Topics include gates, combinational and sequential logic circuits, flip-flops, counters, shift registers, multiplexers, decoders and multivibrators.",322,PHYS,"Digital Electronics",3.19,42.00,40.00,16.00,1.00,2.00,1.00,119
"Architecture, programming and interfacing of one or two representative processors. Instruction sets and assembly language programming. Interfacing of memory and support chips such as USART. Programmable controllers, timers and peripheral I/O devices. Serial and parallel port interfacing.",413,PHYS,"Computer Architecture and Interfacing",3.60,60.00,40.00,0.00,0.00,0.00,0.00,10
"Senior seminar for physics majors. Introduction to research practices. Preparation for PHYS 490 projects.",470,PHYS,"Senior Seminar",3.94,95.00,3.00,3.00,0.00,0.00,2.00,94
"Descriptive and analytical examination of American political parties and pressure groups with attention to political socialization and voting behavior.",301,POSC,"Political Parties and Pressure Groups",2.60,18.00,42.00,27.00,2.00,9.00,4.00,78
"Comparative study of the government systems, political processes, leadership, political parties, elections and current political issues in Britain, France and Germany and an overview of the European community.",310,POSC,"Comparative European Government",3.34,51.00,33.00,13.00,0.00,2.00,4.00,190
"Comparative study of the historical backgrounds, ideological foundations, leadership, opposition groups, political processes and current issues in the governmental systems of selected developing countries.",311,POSC,"Comparative Government of Developing Nations",2.65,26.00,33.00,24.00,6.00,9.00,5.00,232
"Explores both the idea of democracy and its possibilities for realization in human society. Advocates and critics of democracy, both old and contemporary, are examined.",370,POSC,Democracy,2.80,30.00,27.00,33.00,4.00,4.00,5.00,87
"Explores theoretical explanations of international conflict. Major questions addressed are: What are the primary causes of war? How may war be prevented?",409,POSC,"Causes of War",2.19,16.00,23.00,28.00,6.00,16.00,13.00,88
"Examines the most important economic issues in the current global economy and compares and contrasts liberal, statist and Marxist theories of international political economy. Topics include the debate over globalization, the formation and operation of regional economic blocks, the goal of sustainable development and the challenge of transition in post-socialist societies.",413,POSC,"International Political Economy",3.26,51.00,33.00,9.00,1.00,5.00,3.00,125
"Explores civil rights and liberties of the individual under the United States constitution, including freedom of religion, speech, press, right to privacy, and race and sex discrimination.",450,POSC,"Civil Rights and Liberties",2.97,38.00,35.00,10.00,9.00,5.00,6.00,91
"Examination of the use and misuse of drugs, both legal and illegal, from biological, historical, psychological, and social perspectives.",313,PSYC,"Drugs and Behavior",2.75,23.00,42.00,29.00,3.00,5.00,1.00,127
"Scientific study of the psychological experience and functioning of women. Topics include gender roles, work, relationships, childbirth, physical health, eating disorders and sexual victimization.",334,PSYC,"Psychology of Women",3.00,31.00,43.00,23.00,3.00,2.00,2.00,414
"Presentation of advanced topics on physiological psychology including the morphological, neurochemical and physiological bases of behavior.",401,PSYC,"Physiological Psychology",3.24,43.00,37.00,16.00,3.00,0.00,3.00,196
"Study of human sensory and perceptual systems with emphasis on vision. Perception treated from a physiological, behavioral and cognitive point of view.",450,PSYC,"Sensation and Perception",2.87,31.00,34.00,23.00,4.00,5.00,6.00,354
"Introduction to respiratory therapy with emphasis on the physiologic basis of respiratory care. Covers basic principles, procedures and practices utilized in the profession.",210,RESP,"Foundation Studies in Respiratory Therapy",3.29,48.00,35.00,10.00,2.00,3.00,5.00,333
"Introduces students to collaborative critical care practice. Prepares students interested in critical care clinical practice to recognize and categorize causes of sudden deterioration of the critically ill patient. Teaches appropriate treatment and interventions for the deteriorating critically ill patient.",458,RESP,"Critical Care: A Multi-Professional Approach",3.74,72.00,25.00,0.00,0.00,0.00,4.00,64
"Study of materials and methods for teaching language arts in middle and high schools, with attention to aspects of language study for native speakers of standard English, speakers of non-standard English and English language learners. Various models and strategies for teaching language arts at this level are demonstrated and analyzed. Field experience concurrent with SCED 471.",340,SCED,"Teaching Language in Middle and High School English Classrooms",3.73,73.00,28.00,0.00,0.00,0.00,0.00,22
"In-depth study of literacy needs of diverse student populations. Includes instructional and assessment methods in reading and writing. Intended for Secondary and K-12 teacher certification candidates.",424,SCED,"Teaching Reading in the Content Areas: Part II",3.75,76.00,22.00,2.00,0.00,0.00,1.00,124
"Study of strategies and materials that support reading, writing, speaking and listening in content area study of secondary English language arts, with emphasis on methods of teaching language and writing and technology integration. Long-range planning and assessment are examined as elements for integrating the language arts. Required classroom visitations and field experiences.",471,SCED,"Teaching English in Grades 7-12, Part II",3.86,87.00,14.00,0.00,0.00,0.00,0.00,22
"Continuing analysis of middle and high school programs in social studies. Emphasis on methods of teaching history, geography, economics and citizenship. Current curriculum trends are considered. Includes development of strategies and skills for teaching social studies with technology. Continuation of SCED 372. Required classroom visitations and field experiences as necessary to complete assignments.",472,SCED,"Teaching Social Studies in Grades 7-12, Part II",3.57,73.00,19.00,5.00,1.00,4.00,1.00,116
"Second course of a two-course sequence dealing with techniques for teaching mathematics. Includes organization of teaching units, assessment, observation and evaluation of teaching in middle and high school settings. Includes development of strategies and skills for teaching mathematics with technology. Required classroom visitations and field experiences as necessary to complete assignments.",473,SCED,"Teaching Mathematics in Grades 7-12, Part II",3.83,84.00,17.00,0.00,0.00,0.00,0.00,24
"Examines of the diversity of families in the U.S. Study of the demographic trends in family formations, marital arrangements, parenting and childbearing, and such controversial issues as unmarried couples, alternative families, abortion, surrogacy and violence in families.",220,SOCI,"The Family",3.30,40.00,35.00,11.00,0.00,1.00,13.00,100
"Focuses on questions about why humans use violence to resolve interpersonal, intergroup and international conflict by examining strategies of conflict management and peacebuilding and the sociology of `positive' peace. Includes a civic engagement component requiring an average of three hours per week outside of class over the semester engaged in work with a local organization on peace-building. Enhances technological and information literacies as well as critical thinking and command of language. Integrates knowledge developed in a variety of disciplines.",225,SOCI,"Social Conflict and Achieving Peace: A Sociological Perspective",2.67,24.00,18.00,29.00,3.00,6.00,24.00,39
"Selected areas in varied subfields of sociology.",301,SOCI,"Studies in Sociology",2.99,41.00,34.00,12.00,2.00,9.00,3.00,159
"Analysis of the variety of class and rank structures found in both past and contemporary societies. Special attention focused on the determinants of social class as well as the related issues of social mobility and changes in class position of both individuals and groups. Additional emphasis on identifying both attitudinal and behavioral consequences of class position.",304,SOCI,"Social Inequality",2.83,25.00,39.00,28.00,2.00,4.00,5.00,118
"Consideration of crime and delinquency as forms of deviant behavior; examination of social causes, social reactions and applicable sociological theories.",313,SOCI,"Criminology and Penology",3.15,40.00,40.00,17.00,1.00,3.00,2.00,248
"Introduction to qualitative and quantitative social research methods. Emphasis on research design, question formulation, sampling techniques, hypothesis testing, data analysis, computer processing and practical research activity.",321,SOCI,"Social Research",2.63,23.00,36.00,26.00,6.00,8.00,5.00,151
"Examines the environment as a social product. Uses the sociological perspective to explain how environmental problems are structurally created. Focuses on mining and forestry to illustrate how environmental degradation, disease, death and disability are produced.",390,SOCI,"Sociology of the Environment",3.03,29.00,51.00,16.00,3.00,2.00,1.00,237
"Analysis of the historical antecedents and contemporary profiles of sociological theory emphasizing major figures and dominant paradigms.",421,SOCI,"Theory I, Foundations of Sociological Theory",3.24,45.00,40.00,10.00,2.00,4.00,3.00,160
"Presents an integrated biopsychosocial approach to human behavior in older people. Addresses changes in demographic patterns and family patterns, which affect older adults today. Includes an overview of social work practice with older people, and the policies and programs that serve them. Examines differences between and among special populations with increased emphasis on race, class, gender and sexual orientation.",350,SOWK,"Social Work with Older People",3.40,57.00,28.00,6.00,2.00,4.00,6.00,58
"Examines child welfare services and current policies in social work for children and their families. Explores the history of child welfare, the role current social problems such as poverty, teen pregnancy, violence, addiction, homelessness, human trafficking and war play in today's changing family. Provides an overview of the range of services available for families and children within the child welfare delivery system, including in-home services, foster care and adoption.",450,SOWK,"Social Work with Families and Children",3.43,55.00,31.00,6.00,2.00,2.00,7.00,312
"Investigates the role of the social work profession within the
mental health delivery system utilizing a generalist social
work approach. Social work and mental health concepts,
policies, research methods and program development examined in social service agencies, community mental health
facilities and institutional accommodations.",470,SOWK,"Social Work in Mental Health",3.56,68.00,28.00,0.00,0.00,4.00,0.00,25
"work approach. Social work and mental health concepts,",482,SOWK,"mental health delivery system utilizing a generalist social",3.36,59.00,20.00,7.00,0.00,7.00,9.00,46
"Explore the unique problems and social needs of non-urban areas, particularly small towns and rural communities. Comprehend the social structure of such communities as well as the challenges of living in such areas, such as lack of, or remoteness of, resources, poverty and the need to seek alternative interventions to work with the client populations.",483,SOWK,"Social Work Practice in Rural Environments",3.50,70.00,13.00,13.00,0.00,3.00,3.00,39
"Study of modern Spanish and Spanish American literature within its cultural context. Students will explore the literary text as cultural document including the roles of Afro-Hispanics, indigenous peoples, religion, women, politics and poverty in the formation of Hispanic cultures.",403,SPAN,"Hispanic Culture Through Literature",3.44,60.00,32.00,7.00,0.00,4.00,0.00,32
"Introduction to theatre as a unified art with emphasis upon the literary and social significance of theatre in our society.",100,THEA,"Theatre Appreciation",3.55,68.00,21.00,6.00,3.00,2.00,4.00,324
"Provides supervised experience in theatre production and performance.",125,THEA,"Theatre Practicum",0.00,0.00,0.00,0.00,0.00,0.00,100.00,4
"Develops voice and body awareness through methods of vocal production, theatre movement and body conditioning, and performance style and analysis.",200,THEA,"Voice and Movement Fundamentals",3.67,67.00,25.00,4.00,0.00,0.00,6.00,92
"Practical survey of techniques in the application of theatrical makeup for performance on stage as well as television and film. Recommended for all performers.",223,THEA,"Makeup Design",3.21,50.00,30.00,11.00,0.00,7.00,4.00,64
"Explores the creative acting process by investigating the emotional, intellectual and kinesthetic resources central to performing. Examines the application of vocal and physical choices to develop characters. Analysis of texts, theory and the conventions of psychological realism are highlighted through focused improvisation, movement exercises and monologue/scene study.",250,THEA,"Acting I",3.47,61.00,28.00,9.00,0.00,2.00,1.00,102
"Surveys the evolution of formal social theatre from ritual origins through the Renaissance. A social history of dramatic theory, plays and playwrights, production practices and performance styles, emphasizing their roles as both product of and mirror to changing values, tastes, attitudes and customs.",300,THEA,"History of the Theatre I",3.48,61.00,31.00,5.00,2.00,3.00,2.00,91
"Intensive study of a selected topic in theatre.",490,THEA,"Seminar in Theatre",3.79,85.00,10.00,3.00,0.00,2.00,2.00,71
"Summarizes the University theatre experience through the active planning and execution of professional materials, including audition monologue and portfolio, leading to a senior showing with exit interview.",499,THEA,"Capstone Seminar",3.55,62.00,33.00,7.00,0.00,0.00,0.00,31
"Discussion of technical tax provisions as they pertain to corporations and partnerships. Review and analysis of corporate tax provisions. Use and completion of IRS forms.",342,ACCT,"Federal Income Tax Accounting: Partnership and Corporation",3.14,43.00,32.00,17.00,6.00,1.00,4.00,115
"Examination of the full range of accounting and reporting policies and procedures for state and local governments as well as for not-for-profit organizations.",415,ACCT,"Governmental and Not-For-Profit Accounting",3.15,36.00,49.00,15.00,0.00,2.00,0.00,54
"A comprehensive survey of the indigenous peoples and traditional cultures of a specific region of the world, focusing on ethnographic and linguistic research.",201,ANTH,"Cultural Anthropology Survey",2.40,27.00,20.00,27.00,12.00,12.00,4.00,52
"Study of beliefs and rituals of people affected by the presence of gods or other supernatural beings. Topics include magic, witchcraft and shamanist practices among aboriginal and traditional societies throughout the world.",215,ANTH,"Religion, Magic and Witchcraft",2.19,12.00,32.00,25.00,9.00,15.00,10.00,169
"Introduction for non-graphic design majors to the principles of graphic design and layout, and to the basic software packages used in graphic design. Designed to help fine arts majors prepare and present images of their artwork in a professional manner, and should be taken in the junior or senior year.",227,ART,"Digital Design and Layout",3.73,73.00,20.00,4.00,0.00,0.00,5.00,118
"Survey of painting, sculpture and architecture in the principal art centers of Italy during the 15th and 16th centuries. Covers the work and influence of several generations of major artists in relation to the larger historical, social and cultural contexts of this era.",310,ART,"History of Italian Renaissance Art",2.91,47.00,21.00,15.00,7.00,10.00,3.00,96
"Upper-level course that covers advanced projects in photography using digital technology. Students should have a basic understanding of photographic composition and of basic computer skills required for digital imaging. A digital camera is required. May be taken for a maximum of eight credits.",359,ART,"Advanced Digital Photography",3.31,54.00,30.00,8.00,0.00,6.00,5.00,92
"Advanced study in one or a combination of studio disciplines or art history. Students furnish their own materials.",390,ART,"Advanced Study in Art",3.51,58.00,12.00,15.00,0.00,0.00,17.00,42
"Review of the history and governance of the athletic training profession. Addresses the body of knowledge and primary responsibilities of the athletic trainer. Basic skills in risk management and injury prevention are emphasized. An overview of the clinical requirements for the athletic training major is provided.",210,ATTR,"Foundations of Athletic Training",3.33,52.00,33.00,9.00,2.00,3.00,5.00,349
"Designed as a culminating experience to prepare students as
professionals in the field of athletic training. Students select a
clinical site, other than Salisbury University, and are exposed
to alternate clinical practice and philosophies of athletic training services. Exposure assists students in developing their
own ideals in the field of athletic training.",479,ATTR,"Athletic Training Practicum",0.00,0.00,0.00,0.00,0.00,0.00,0.00,0
"Introduction to the history and literature of biology. Special emphasis on the development of contemporary concepts and techniques of information retrieval.",301,BIOL,"History and Literature of Biology",2.16,13.00,26.00,22.00,26.00,6.00,10.00,55
"Study of the important parasites of humans and domestic animals.",322,BIOL,Parasitology,2.73,18.00,45.00,23.00,8.00,2.00,7.00,110
"Study of gross and microscopic plant structure, with special emphasis on higher plants.",325,BIOL,"Plant Anatomy",2.28,6.00,45.00,23.00,28.00,0.00,0.00,18
"Basic course dealing with the cellular and chemical aspects of immunity. Antigen-antibody reaction surveyed and its clinical laboratory implicationd thoroughly discussed.",333,BIOL,Immunology,2.60,27.00,29.00,27.00,7.00,9.00,5.00,73
"Study of birds. Topics include form and function, systematics, speciation, behavior and communication, reproduction, migration, ecological topics including demography, population dynamics, community structure and conservation. Field trips emphasize identification and natural history of local species.",405,BIOL,Ornithology,3.54,62.00,33.00,7.00,0.00,0.00,0.00,59
"Study of structure, replication and pathogenesis of viruses with emphasis on animal viruses and the role of viruses in our current understanding of cell and molecular biology.",445,BIOL,Virology,2.81,29.00,34.00,27.00,7.00,4.00,4.00,133
"Study of applied aspects of biology with an emphasis on DNA technology. Recommended as a capstone course for biology majors in the cell and molecular biology/biotechnology track.",470,BIOL,Biotechnology,2.56,19.00,28.00,19.00,19.00,0.00,19.00,11
"Intern experience in business or government. May be used as a business concentration/track elective if approved by the school dean.",490,BUAD,"Business Internship",3.89,89.00,12.00,0.00,0.00,0.00,0.00,72
