description,courseNumber,departmentCode,courseTitle,avg_gpa,A_rate,B_rate,C_rate,D_rate,F_rate,W_rate,total_enrollment
"A study of the Transcendental Movement and literature between 1830 and 1870. Emphasis on the works of Emerson, Thoreau, Hawthorne, Melville, Whitman and Dickinson.",481,ENGL,"The American Renaissance",3.05,39.00,31.00,22.00,3.00,3.00,5.00,42
"Questions how human systems of distribution of resources, of space and of pollution intersect with environmental degradation, human health concerns and access to environmental amenities. Central to this framing of environmental studies is the question of equity - what is fair and just? How do environments replicate systems of human injustice or exploitation? Focus is historical and contemporary, analyzing current environmental justice concerns and considering their historical antecedents.",320,ENVR,"Environmental Justice",3.02,34.00,35.00,22.00,2.00,3.00,7.00,138
"Focuses on why preserving biodiversity is critical for nature and humankind. Learn ways to describe biodiversity at different scales, discuss major threats to biodiversity, and explore methods for conserving and preserving biodiversity. Focuses on the role that local communities play in conservation, with visits to local conservation organizations and researchers.",353,ENVR,"Conservation and Biodiversity",3.30,51.00,34.00,9.00,2.00,3.00,3.00,235
"Examines the dynamics and processes of the tropical atmosphere, from localized trade wind convection to tropical cyclones. The role of tropical atmospheric processes in global climate variability also is investigated.",314,GEOG,"Tropical Meteorology",3.30,57.00,23.00,16.00,3.00,3.00,0.00,44
"Theory and application of computer programming solutions in geography. Focuses on developing custom computer programs addressing classical problems in geography and spatial analysis not ordinarily solved using out-of-the box GIS software. Introduction to basic programming techniques, object model diagrams, component object modeling (COM) and spatial databases.",435,GEOG,"GIS Programming",4.00,100.00,0.00,0.00,0.00,0.00,0.00,10
"Introduction to the geological and hydrological processes operating at and within Earth's surface and subsurface. Focus on practical applications of natural flow systems and principles of fluid flow through porous media, including an indepth study of groundwater flow concepts, such as flow nets, hydraulic potential and saturated and unsaturated flow; solute transport; and quantitative hydrogeologic methods for assessing groundwater quality, quantity and movement.",407,GEOL,Hydrogeology,3.12,31.00,56.00,12.00,0.00,3.00,0.00,43
"Explore American politics and society between Lincoln and Theodore Roosevelt. Cover the challenges of Reconstruction and subsequent race relations, industrial transformation and its discontents, everyday life of immigrants and native-born, science and religion, the depression of the 1890s, and continental and overseas imperialism.",309,HIST,"Americans in the Gilded Age, 1865-1905",3.02,36.00,38.00,15.00,7.00,3.00,5.00,48
"Surveys Scottish history from the age of the Picts and Roman contact through the fall of Bonnie Prince Charlie at Culloden in 1746. Emphasizes the creation of a Scottish state, Scottish religious and cultural developments, and the path toward the Union of the Crowns and the creation of a United Kingdom with England.",313,HIST,"History of Scotland as an Independent Kingdom",2.51,27.00,25.00,22.00,4.00,15.00,9.00,56
"Survey of the political, social and economical history of the Middle East from the rule of Islam to the 19th century. Emphasis on the rise and decline of the Arab Caliphates, Persia and the Ottomans.",350,HIST,"The Middle East to 1800",2.90,33.00,32.00,16.00,6.00,6.00,10.00,76
"Chinese civilization from its origins in the Bronze Age to the rise of nationalism and communism in the 20th century. Attention divided equally between political and cultural history, emphasizing the development of traditional institutions in Chinese society, as well as art, literature, religion and philosophy.",362,HIST,"Chinese Civilization",3.11,29.00,56.00,7.00,4.00,2.00,4.00,59
"Study of the events that occurred during World War I, from the assassination of Franz Ferdinand at Sarajevo to the peace of 1919. Emphasis on political developments, social and intellectual implications of the war, and its significance in shaping the 20th century.",451,HIST,"World War I",2.72,18.00,45.00,27.00,5.00,3.00,3.00,67
"Examines the military history of the modern world from 1500 AD to the present. The focus is on the strategy and tactics used by modern armies, how these affected the lives of populations and how new developments in these fields have influenced the history of the modern world.",477,HIST,"Military History of the Modern World",3.29,47.00,32.00,15.00,0.00,2.00,7.00,63
"Explores the fundamental characteristics and organizational structures of the U.S. health system as well as the differences in systems in other countries. Learn basic concepts of legal, ethical, economic and regulatory dimensions of health care and public health policy and the roles, influences and responsibilities of the different agencies and branches of government.",450,HLTH,"U.S. Health Care and Public Health",3.68,73.00,21.00,6.00,0.00,0.00,2.00,202
"An introduction to both classical and modern methods of cryptography, cryptoanalysis and the mathematical principles behind these methods. Topics include an introduction to number theoretic concepts, classical cyphers and their history, modern symmetric and public-key cyphers, and a mathematical analysis of the strengths and weaknesses of cryptographic methods.",447,MATH,Cryptography,2.82,42.00,17.00,17.00,9.00,9.00,9.00,12
"Provides an overview of the practical and theoretical approaches to training and developing employees in organizations, and of the broader area of human resource development. Topics covered include basic concepts such as motivation and learning theory, needs assessment, and the evaluation of training. Different types of training programs are examined, including skills training, team building, diversity training and management development.",456,MGMT,"Employee Training and Development",3.56,62.00,33.00,4.00,0.00,1.00,1.00,107
"Explores the dimensions of creative and innovative leadership strategies and styles by examining team dynamics and two historical leadership theories that form the basis of Army leadership framework (trait and behavior theories). Practice aspects of personal motivation and team building in the context of planning, executing and assessing team exercises. Two hour lab required per week.",205,MLSC,"Foundations of Leadership I",3.86,89.00,0.00,0.00,0.00,4.00,8.00,63
"Provides a basic introduction to logic, emphasizing modern symbolic methods. Nature of formal deductive proof is given special attention.",202,PHIL,"Introduction to Symbolic Logic",2.81,35.00,22.00,15.00,10.00,6.00,14.00,87
"The absorption of Greek philosophical concepts by Christianity, Judaism and Islam. Study of the great medieval systems constructed to strengthen revealed religions and the skeptical revolts against them. Augustine to the medieval mystics.",309,PHIL,"Medieval Philosophy",3.53,64.00,25.00,7.00,4.00,0.00,4.00,33
"Study of the recent history and politics of women's rights in the U.S. and the impact of the women's movement in its various manifestations. Examines the route to political activism taken by women and the issues that unite and divide them.",205,POSC,"Women in Politics",3.13,42.00,35.00,15.00,0.00,5.00,5.00,41
"Examines the history and evolution of the UN system. Focuses on the role of the UN in settling international disputes, providing international order and security, promoting decolonization, promoting human and political rights, and providing for economic and social development around the world.",415,POSC,"The United Nations System",3.24,48.00,33.00,11.00,4.00,3.00,4.00,122
"Study of the basic characteristics of modern American governmental bureaucracies, as well as the important issues public administrators face. Exploration of administrative and organizational theories.",440,POSC,"Public Administration",3.33,57.00,16.00,14.00,0.00,5.00,10.00,44
"Concerned with how attitudes are formed, measured and changed. Emphasis on the classical theories and new approaches to attitude formulation and change.",406,PSYC,"Psychology of Attitudes and Attitude Change",3.20,42.00,39.00,14.00,5.00,0.00,2.00,67
"Introduction to brain/behavior relationships with emphasis on patients with known brain damage. Examines types of brain damage, related loss of function, neuropsychological assessment and course of recovery.",446,PSYC,"Fundamentals of Human Neuropsychology",3.19,51.00,28.00,16.00,0.00,6.00,1.00,106
"Internship experience for psychology majors in a variety of clinical or non-clinical settings. Provides faculty and peer mentorship on a variety of professional development topics. 135 internship hours required.",486,PSYC,"Internship in Psychology",0.00,0.00,0.00,0.00,0.00,0.00,100.00,1
"Teaches the knowledge, skills, behaviors and dispositions needed for leaders in a variety of settings and organizations. Prepare for leadership roles in the community and professions. Develop a fundamental understanding of the theoretical and learnable skills necessary for success in personal and professional areas. Apply skills and dispositions through a leadership growth plan.",101,SCED,"Learning Leadership",3.63,75.00,17.00,4.00,2.00,2.00,2.00,251
"Focuses on the question: What empowers women? Explores issues of gender equity using socio-cultural theories of gender and development to examine women's (and men's) social roles across a range globalized social contests and geographic regions. Some familiarity with events and realities outside the U.S. is expected. Designed to enhance technological and information literacies as well as critical thinking and command of language. Integrates knowledge developed in a variety of disciplines.",363,SOCI,"Global Gender Equity",2.67,34.00,17.00,17.00,6.00,12.00,17.00,18
"Surveys Western theatre from the Elizabethan period to the present. Examines the influence of non-Western forms and developing aesthetics of Early Modern drama. Connects the diverse social, political and philosophical forces that shape the theatre as an expression of the modern world.",301,THEA,"History of the Theatre II",3.42,56.00,34.00,10.00,0.00,2.00,0.00,72
"Advanced scene study acting focusing on the challenges specific to blank verse. Guided exercises explore and refine technical skills.",450,THEA,"Acting Shakespeare",3.50,58.00,36.00,8.00,0.00,0.00,0.00,14
"Survey of the art and architecture of the indigenous civilizations of Mexico, Central America and the Andean region of South America from approximately 2000 BCE until European Conquest.",311,ART,"History of Pre-Columbian Art",3.00,26.00,43.00,17.00,5.00,0.00,11.00,66
"Study of the intermediary metabolism of biomolecules and the biochemistry underlying the expression of information contained in DNA in the synthesis of biomolecules.",418,CHEM,"Biochemistry II",3.58,64.00,31.00,6.00,0.00,0.00,0.00,36
"Continuation of CHEM 441. Blended lecture/lab experience in experimental chemistry. Emphasis on the relationship between synthesis, instrumental methods and molecular structure.",442,CHEM,"Advanced Experimental Chemistry II",3.43,49.00,46.00,6.00,0.00,0.00,0.00,35
"Intermediate study of the principles and practices of news reporting. Exposure to covering news beats, establishing news sources, and producing accurate and comprehensive multimedia journalism news products. Introduction to the basics of producing and editing digital photos, video and audio, along with the ethical considerations when collecting sound and visuals.",241,CMAT,"Journalism II",3.65,67.00,32.00,2.00,0.00,0.00,0.00,57
"Advanced study of the theory and practice of feature writing. Produce, edit and critique a range of feature writing styles for a range of platforms.",349,CMAT,"Advanced Feature Storytelling",2.96,20.00,56.00,24.00,0.00,0.00,0.00,25
"4 hours credit Study of various concepts, theories and/or practices in multimedia journalism. May be taken twice under different subtitles.",395,CMAT,"Studies in Multimedia Journalism",3.79,79.00,22.00,0.00,0.00,0.00,0.00,14
"Introduction to processes and skills required to plan, design, and direct drama for the television/film medium. Study the formalistic elements of the medium and complete the required projects designed to provide practical experience in planning and then directing material that persuades, informs and entertains audiences. Fundamentals of the language of television/film are stressed: aesthetics and their application. Emphasis on the communication between directors and actors, effective use of the audiovisual language, camera blocking and visual storytelling.",435,CMAT,"Directing for the Camera",3.47,63.00,32.00,3.00,0.00,5.00,0.00,45
"Introduction to the mathematical and statistical tools that economists use to examine economic behavior. Univariate calculus, multivariate calculus, linear algebra and optimization are reviewed and applied to economic models. Statistical principles, hypothesis testing and regression analysis are introduced as tools to empirically examine economic theories.",230,ECON,"Quantitative Economics",2.47,26.00,20.00,21.00,8.00,12.00,17.00,231
"Introduction to influential theoretical approaches to film such as psychoanalysis, auteurism, feminism, reception and spectatorship theories, genre studies, queer theory and post-Colonial criticism. Includes a range of screenings and encourages students to read films in terms of various cultural, ideological and personal perspectives.",408,ENGL,"Film Theory",3.42,59.00,26.00,17.00,0.00,0.00,0.00,31
"A study of what it means to be a bilingual child or adult. Explores the mind's role in bilingualism and in language acquisition. Surveys educational systems' response to language variance among students and explores the social, academic and language learning consequences of growing up bilingual in the U.S.A.",438,ENGL,Bilingualism,3.56,78.00,11.00,5.00,3.00,5.00,2.00,74
"Read, discuss and analyze contemporary nonfiction to observe techniques in craftsmanship and present nonfiction for intensive examination by workshop participants.",455,ENGL,"Non-Fiction Workshop",3.60,68.00,17.00,8.00,0.00,2.00,8.00,67
"Interdisciplinary investigation of the political, social and economic relations of waste. Considers what our wasting practices can tell about the causes and consequences of environmental degradation.",315,ENVR,"Garbage and Everyday Life",3.73,80.00,14.00,7.00,0.00,0.00,0.00,15
"Overview of GIS technology and its use in decision making for various disciplines. The disciplines include social, health and environmental sciences, urban planning, and government operations. Includes three hours of lecture per week and a supplemental laboratory session where students perform hands-on laboratory exercises using GIS software.",304,GEOG,"Decision Making With GIS",3.02,39.00,39.00,12.00,4.00,6.00,2.00,52
"A revolving set of topics presented by geography faculty or invited speakers related to the scientific or socio-economic effects of climatic change on modern society.",409,GEOG,"Dimensions of Climatic Change",3.44,60.00,10.00,10.00,0.00,5.00,19.00,22
"Analysis of a selected systematic/regional topic to be entered on the student's transcript.",450,GEOG,"Topics in Geography",3.23,61.00,22.00,0.00,0.00,14.00,5.00,23
"Study of the origins, development and outcome of the struggle between the North and South to the end of the Civil War. Emphasis on the clash of national and sectional interests and the course of the military conflict to its conclusion.",308,HIST,"Sectional Conflict and Civil War",3.08,33.00,44.00,19.00,0.00,2.00,4.00,53
"Development of indigenous political and social institutions leading to the formation of states and empires. The slave trade and the onset of European imperialism emphasized.",340,HIST,"History of Africa to 1870",2.09,8.00,35.00,24.00,4.00,20.00,12.00,26
"Study of Maryland history and government from the colonial period to present. Places special stress on the leaders, institutions and contributions made in Maryland and by Maryland to the nation.",400,HIST,"History of Maryland",3.05,24.00,62.00,10.00,5.00,0.00,0.00,21
"Study of the Russia empire from Peter the Great to the 1917 revolution focusing on the political, economic and social developments, Russia's expansion and the conditions that led to revolution.",423,HIST,"Imperial Russia",2.97,24.00,49.00,14.00,3.00,3.00,10.00,43
"The Second World War has shaped the contemporary world as no other 20th century event has. Through discussion and study of texts and film, this course examines the global political, military and economic aspects of the conflict as well as its social and cultural impact.",452,HIST,"The Second World War: A Global History",2.93,34.00,36.00,21.00,6.00,4.00,2.00,59
"The revolutionary transformation of China from the 19th century to the present, with emphasis on the impact of imperialism, the profound effects of Western technology and foreign policy wrought by the history of its relations with the West.",460,HIST,"History of China Since 1800",3.00,27.00,60.00,7.00,0.00,7.00,0.00,30
"Covers historical foundations of epidemiology; distributions and causes of disease by time, place and person; epidemiological study designs; and special issues in infectious and non-infectious disease epidemiology. Learn epidemiology's role in public health practice by identifying and tracking disease patterns to assist in disease prevention programming.",330,HLTH,"Principles of Epidemiology",3.85,87.00,11.00,3.00,0.00,0.00,1.00,119
"Cross-cultural approach to the study of the German culture through the language, traditions and the lifestyle of the people. Taught in English.",245,MDFL,"The German People",3.08,30.00,54.00,8.00,4.00,2.00,2.00,50
"Learn how the best corporations are developed through a systematic and holistic approach to management, examining the interplay between managerial processes such as leadership, culture, recruitment, selection, training and development, acculturation, engagement, and rewards. Study how companies, both domestically and internationally, have used such a systematic approach to build sustainable businesses.",455,MGMT,"Designing High-Performance Work Systems",3.05,28.00,50.00,5.00,10.00,0.00,10.00,22
"Builds on the skills learned in the Professional Selling class. Master the selling process using multiple role plays. Features an experiential component introducing real-life selling processes and practices. Other concepts introduced include team selling, selling with technology, written sales and proposals. Gain an introduction to career management and other personal development activities.",410,MKTG,"Advanced Professional Selling",3.09,37.00,39.00,18.00,3.00,2.00,2.00,200
"Explores the challenges of leading teams in the operational environment. Further study of the theoretical basis of leadership explores the dynamics of adaptive and situational leadership in the context of operations and organizational management. Develop greater self-awareness while assessing personal leadership styles and practicing communication and team-building skills. Practical exercises give insight into the importance and practice of teamwork in real-world scenarios. Two hour lab required per week.",206,MLSC,"Foundations of Leadership II",3.79,90.00,6.00,2.00,0.00,3.00,0.00,68
"Study of a selected health care-related book over the course of a semester with opportunities for discussion of pertinent issues and self-reflection. Reading titles and health care topics vary semester to semester.",401,NURS,"Readings in Health Care",3.71,69.00,25.00,2.00,0.00,0.00,6.00,89
"Instruction, preparation and participation in camping and backpacking activities. Emphasizes knowledge, skills and attitudes for outdoor pursuits, and encourages awareness and respect for the natural environment. Weekend off-campus field experience required. Course fees apply; contact minor coordinator.",209,ODEL,"Camping and Backpacking",3.68,75.00,17.00,6.00,0.00,1.00,2.00,108
"The PADI Advanced Diving Program consists of five Adventure Dives. These include Peak Performance Buoyancy, Underwater Navigation, Night Diving, Deep Diving, and Search and Recovery Diving. These areas are covered and skill competencies developed in order to obtain advanced open water certification. Explain and demonstrate knowledge of the fundamentals involved in theses topics. Course fee applies.",212,ODEL,"Advanced Scuba",3.60,82.00,0.00,0.00,0.00,10.00,10.00,22
"Study of the history, objectives and trends of organized camping, including organization of day, residential and high adventure camps. Learn administrative best practices for staff hiring and training, techniques of camp counseling, program planning and an introduction to campcraft skills. Course fees apply; contact minor coordinator.",370,ODEL,"Camp Leadership and Management",3.77,84.00,9.00,5.00,0.00,1.00,1.00,100
"Study of techniques for planning, promoting and leading outdoor adventure activities with special emphasis on understanding leadership theory, minimizing risk and liability, and promoting sustainable practices. Weekend off-campus field experience required. Course fees apply; contact minor coordinator.",371,ODEL,"Outdoor Leadership Techniques",3.82,92.00,2.00,3.00,0.00,4.00,3.00,96
"Involves students in thinking through the ultimate questions philosophy asks about God's nature and existence. Attention given to a variety of themes, including the relationship between God and nature, the personhood of God, atheism and the meaningfulness of human speech about God.",402,PHIL,"The Problem of God",3.55,62.00,20.00,0.00,3.00,3.00,14.00,36
"Examination of state and local governments in terms of how political power is organized and policies adopted. Focuses on forms of governing that encourage citizen participation.",202,POSC,"State and Local Government In the United States",2.86,33.00,36.00,14.00,4.00,9.00,7.00,94
"In-depth study of contemporary social movements, such as the Black Muslims, Gay Liberation, the Women's Movement, the aged, youth and radical right.",320,SOCI,"Social Movements",3.64,70.00,18.00,3.00,0.00,3.00,8.00,39
"Introduces theoretical perspectives on substance misuse and mental health, including a working knowledge of their incidence and prevalence. Provides an overview of physiological, psychological and social impacts influenced by substance misuse and mental health with particular emphasis on vulnerable populations.",451,SOWK,"Behavioral Health",3.31,54.00,23.00,14.00,3.00,3.00,7.00,90
"Study of voice production and articulation with emphasis on accents and regional dialects focuses on the skills of performance and voice in characterization.",430,THEA,"Accents and Dialects",3.60,64.00,34.00,4.00,0.00,0.00,0.00,30
"Analysis and discussion of issues relating to fraud and forensic accounting. Identify the resources for detecting fraud, evaluate the conditions that encourage fraud, and design effective fraud detection and prevention plans. Focus on the perspective of public, internal and private accountants. Discuss the principles and standards for proactive and reactive investigation, as well as detection and control of fraud. Focus on the high-risk fraud environments where assets are more vulnerable to misappropriation and fraud because of either lack of, or because of non-functioning, internal controls. The study of various fraud investigative methods emphasizes the skills needed to identify, investigate, and litigate fraud and forensic accounting allegations.",450,ACCT,"Advanced Fraud Examination",3.47,58.00,34.00,6.00,2.00,2.00,2.00,92
"Provides guidance and knowledge for conducting investigations via data analysis. Involves investigation into the technology tools that are used in fraud examination and financial forensics. Become familiar with innovative analytic approaches used to perform complex fraud analysis. Utilize fraud-related software applications and data analysis programs to detect and investigate possible fraudulent activities.",451,ACCT,"Fraud Detection and Prevention Technologies",3.76,76.00,18.00,3.00,0.00,0.00,5.00,117
"Survey of ancient Greek and Roman art and architecture, beginning with the emergence of Greek civilization in the ninth century B.C. and ending with the fall of the Roman empire. Considers the style, subject matter and varied purposes of Greek and Roman art in relation to the changing historical, social and cultural contexts of this era.",306,ART,"History of Greek and Roman Art",2.81,34.00,38.00,17.00,3.00,11.00,0.00,48
"Continuation of advanced monochromatic and polychromatic drawing techniques using wet and dry media, creating thesis-type projects. Students furnish their own materials.",330,ART,"Drawing III",3.50,55.00,41.00,5.00,0.00,0.00,0.00,22
"Prepares art majors and minors for professional careers in the visual arts and design. Provides a foundation of practical information about career development, self-promotion and contractual issues, among other things, to assist in building a successful career. A portfolio review by faculty committee lays the framework for creating a body of work for ART 499.",397,ART,"Junior Review",3.92,85.00,8.00,0.00,0.00,0.00,8.00,13
"The study of living beings, both on Earth and as they may occur elsewhere in the universe. Use a highly interdisciplinary approach to explore the properties of life, how life may have arisen, the evolution of Earth and its biosphere, and the possible origin, evolution and distribution of life in the universe. The past, present and future astrobiology-related activities of space agencies around the world also are surveyed. Two daylong field trips are required.",326,BIOL,Astrobiology,3.45,59.00,29.00,8.00,2.00,3.00,4.00,99
